{
  "$id": "https://raw.githubusercontent.com/yairm210/Unciv/refs/heads/master/docs/Modders/schemas/CityStateTypes.schema.json",
  "$schema": "http://json-schema.org/draft-07/schema#",
  "title": "CityStateTypes",
  "description": "A list of city state types, including their bonuses and color information.",
  "type": "array",
  "items": {
    "type": "object",
    "properties": {
      "name": {
        "type": "string",
        "title": "Name",
        "description": "The name of the City State Type.",
        "examples": [
          "Cultured",
          "Maritime",
          "Mercantile",
          "Militaristic",
          "Strategic"
        ]
      },
      "friendBonusUniques": {
        "$ref": "refs/Uniques.schema.json",
        "title": "Friend Bonus Uniques",
        "description": "List of unique abilities granted to major civilizations when friends with this city state"
      },
      "allyBonusUniques": {
        "$ref": "refs/Uniques.schema.json",
        "title": "Ally Bonus Uniques",
        "description": "List of unique abilities granted to major civilizations when allied to city state"
      },
      "color": {
        "$ref": "refs/Color.schema.json",
        "description": "RGB color of text in civilopedia",
        "default": [255, 255, 255]
      }
    },
    "required": ["name"],
    "additionalProperties": false
  }
}
